{
  "id": "drekavac",
  "schema_version": 2,
  "names": {
    "primary": {
      "romanized": "drekavac",
      "native": [
        {
          "script": "Cyrl",
          "text": "Дрекавац",
          "people": "Serbs",
          "cites": [
            "karadzic1852:s.v.Дрекавац"
          ]
        }
      ]
    },
    "variants": [],
    "meaning": []
  },
  "peoples_regions": [
    {
      "people": "Serbs",
      "cites": [
        "karadzic1818:s.v.Дрекавац"
      ]
    }
  ],
  "family": {
    "value": "unclassified",
    "cites": []
  },
  "appearance_forms": [],
  "appearance": [
    {
      "text": "Is described as a four-footed animal.",
      "cites": [
        "karadzic1818:s.v.Дрекавац"
      ]
    }
  ],
  "scene": [
    {
      "text": "It is heard screaming in the night.",
      "cites": [
        "karadzic1818:s.v.Дрекавац"
      ]
    },
    {
      "text": "Its scream is like that of a goat that is being carried off.",
      "cites": [
        "karadzic1818:s.v.Дрекавац"
      ]
    }
  ],
  "variants": [],
  "behavior_habitat": [
    {
      "text": "Is a supposed animal that screams in the night.",
      "cites": [
        "karadzic1818:s.v.Дрекавац"
      ]
    },
    {
      "text": "Is glossed as a nocturnal, clamorous animal.",
      "cites": [
        "karadzic1818:s.v.Дрекавац"
      ]
    }
  ],
  "dealing_with_it": [],
  "origin": [],
  "related": [],
  "attestation": {
    "grade": "literary",
    "rationale": [
      {
        "text": "Karadžić’s 1818 Serbian dictionary records the drekavac as a supposed four-footed animal that screams in the night like a goat being carried off.",
        "cites": [
          "karadzic1818:s.v.Дрекавац"
        ]
      },
      {
        "text": "The 1852 edition repeats the article; both editions are Karadžić’s and count as one source by one 19th-century compiler.",
        "cites": [
          "karadzic1852:s.v.Дрекавац"
        ]
      },
      {
        "text": "Every surviving clause rests on this one dictionary article, and the only people is the Serbs, fixed by the dictionary being a Serbian dictionary.",
        "cites": [
          "karadzic1818:s.v.Дрекавац"
        ]
      }
    ],
    "assigned_by": "verify"
  },
  "sources": [
    {
      "source_id": "karadzic1818",
      "author": "Вук Стефановић Караџић (Vuk Stefanović Karadžić)",
      "title": "Српски рјечник истолкован њемачким и латинским ријечма",
      "year": 1818,
      "url": "https://archive.org/details/srpskirjecnik00kara",
      "public_domain": true
    },
    {
      "source_id": "karadzic1852",
      "author": "Вук Стефановић Караџић (Vuk Stefanović Karadžić)",
      "title": "Српски рјечник истумачен њемачкијем и латинскијем ријечима",
      "year": 1852,
      "url": "https://archive.org/details/srpski-rjecnik-istumacen-njemackijem-i-latinskijem-rijecima",
      "public_domain": true
    }
  ],
  "image": {
    "file": "plates/slavic/drekavac.web.webp",
    "thumb": "plates/slavic/drekavac.thumb.webp",
    "prompt": "A monochrome silverpoint character study: a single figure alone on plain off-white paper, drawn only in fine grey metalpoint lines and hatching, like a page from a Renaissance master's sketchbook. A demonic, monstrous creature, a starved demon that is humanoid only in outline. Its legs bend backward at the knee like a dog's hind legs, reverse-jointed, so it stands on its toes. Its stomach is sunken deep beneath the ribs, and its hairless skin is stretched tight. It has huge, long, pointed ears like a bat's. Its mouth gapes wide open, full of long, sharp, needle-like teeth. Its long arms end in long claws, and bony spikes run down its spine. It is hunched and crouched, snarling. Full-length figure: the whole body from head to feet inside the frame, isolated on blank paper. silverpoint study, metalpoint drawing, Renaissance sketch, hatching and cross-hatching, fine line, high contrast, sharp focus, monochrome, clean light paper ground",
    "negative": "painterly fantasy concept art, 3D render, digital painting, colour, color, smooth shading, anime, comic book inking, photograph, text, watermark, border, handwriting, inscriptions, annotations, script, lettering, captions, photorealism, photograph, colour painting, oil painting, background, scenery, landscape, interior, room, hair, fur, goat, ghost, skeleton, bird, chicken, man, person, human face, clothes",
    "model": "fal-ai/qwen-image",
    "seed": 42,
    "date": "2026-10-28",
    "style_tokens_version": "a-2026-10-27",
    "licence": "Apache-2.0",
    "interpretive": true,
    "cost_usd": 0.04,
    "request_id": "01a1804c-e85c-7070-8511-8aa6410416d5",
    "human_edits": [
      {
        "type": "visual-tradition",
        "text": "A monochrome silverpoint character study: a single figure alone on plain off-white paper, drawn only in fine grey metalpoint lines and hatching, like a page from a Renaissance master's sketchbook. A demonic, monstrous creature, a starved demon that is humanoid only in outline. Its legs bend backward at the knee like a dog's hind legs, reverse-jointed, so it stands on its toes. Its stomach is sunken deep beneath the ribs, and its hairless skin is stretched tight. It has huge, long, pointed ears like a bat's. Its mouth gapes wide open, full of long, sharp, needle-like teeth. Its long arms end in long claws, and bony spikes run down its spine. It is hunched and crouched, snarling. Full-length figure: the whole body from head to feet inside the frame, isolated on blank paper.",
        "by": "Ben",
        "date": "2026-10-27"
      }
    ]
  },
  "notes": [
    {
      "kind": "scope",
      "text": "The whole entry rests on one dictionary article, Karadžić's s.v. Дрекавац (1818, repeated in 1852). In 1818 the German and Latin gloss reads: '(supposed) animal that screams in the night like a goat that is carried off by [illegible], animal nocturnum, quadrupes, clamosum'. The agent that carries the goat off is OCR noise in both editions (1818 'vom оте', 1852 'бот Збо[је'), so the clause leaves it out rather than guess. The 1818 OCR prints the headword as 'Древавац'; the native form is taken from the 1852 headword 'ДРЕКАВАЦ', written here in sentence case."
    },
    {
      "kind": "scope",
      "text": "peoples_regions: the dictionary is a Serbian dictionary and the article gives no regional label, so the people is recorded as Serbs with no region. No opened page names Bosnians for this creature."
    },
    {
      "kind": "empty-field",
      "text": "family: the hints file suggests 'undead', but the only page found calls the drekavac a supposed four-footed nocturnal animal and says nothing of the dead, so no family is supported. Searched drekavac, дрекавац, древавац, дрекав, drekav, дрекавца, кавца, drekavatz, drekavaz, screamer, schreyer, quadrupes, clamosum across all sources."
    },
    {
      "kind": "empty-field",
      "text": "names.meaning: the German gloss opening the article (OCR '© фтерег' in 1818, 'ђе Офтејет' in 1852) is too garbled to quote, and no source explains the name; left empty. Same searches as for family."
    },
    {
      "kind": "empty-field",
      "text": "names.variants, variants, origin, dealing_with_it, related: no source found says anything about other names, regional differences, where the drekavac comes from, how to deal with it, or links to other pilot creatures. The only hits for any spelling were the two Karadžić dictionary articles; no hit in machal1918, ralston1872, ralston1873, afanasyev1865-1869, frombald1725, calmet1850v2 or erben1893."
    },
    {
      "kind": "accretion",
      "text": "Editorial: modern popular, cryptid and internet accounts of the drekavac are excluded; this entry records only the cited Karadžić dictionary article."
    }
  ]
}
